{
  "schemaVersion": 1,
  "generatedAt": "2026-09-12T18:51:37Z",
  "count": 78,
  "classifications": {
    "Official": 0,
    "Verified": 1,
    "Community": 1,
    "Experimental": 71,
    "Archived": 5
  },
  "sources": [
    {
      "source_id": "https-raw-githubusercontent-com-927tx-ipa-vault-main-ipavaultsou",
      "source_name": "927tx/IPA-Vault",
      "source_type": "altstore",
      "source_url": "https://raw.githubusercontent.com",
      "classification": "Experimental",
      "verification_status": "unverified",
      "reputation_score": 82.2,
      "health_status": "unknown",
      "uptime": null,
      "first_seen": "2026-09-12T18:15:03Z",
      "last_seen": "2026-09-12T18:51:37Z",
      "last_sync": "2026-09-10",
      "app_count": 13,
      "release_count": 0,
      "apps": [
        {
          "id": "infuseplus",
          "name": "Infuse Plus",
          "version": "8.5.3"
        },
        {
          "id": "glow",
          "name": "Glow",
          "version": "577.1"
        },
        {
          "id": "swiftgram",
          "name": "Swiftgram",
          "version": "12.9.2"
        },
        {
          "id": "telegram-mxgram",
          "name": "Telegram MxGram",
          "version": "12.9.3"
        },
        {
          "id": "iqface",
          "name": "iQFace",
          "version": "578.1"
        },
        {
          "id": "ryukgram",
          "name": "RyukGram",
          "version": "446.0.0"
        },
        {
          "id": "sparkle",
          "name": "Sparkle",
          "version": "446.0.0"
        },
        {
          "id": "nexasc",
          "name": "NexaSC",
          "version": "8.77.0"
        },
        {
          "id": "messenger-flow",
          "name": "Messenger Flow",
          "version": "578.1.0"
        },
        {
          "id": "msgplusx",
          "name": "MSGPlusX",
          "version": "578.1.0"
        },
        {
          "id": "threadsaver",
          "name": "ThreadSaver",
          "version": "446.1"
        },
        {
          "id": "ime",
          "name": "iMe MxGram",
          "version": "12.8.1"
        },
        {
          "id": "turrit-mxgram",
          "name": "Turrit MxGram",
          "version": "1.5.3"
        }
      ],
      "history": [
        {
          "at": "2026-09-12T18:15:03Z",
          "health": "unknown",
          "reputation": 82.2,
          "appCount": 13,
          "verification": "unverified"
        },
        {
          "at": "2026-09-12T18:51:37Z",
          "health": "unknown",
          "reputation": 82.2,
          "appCount": 13,
          "verification": "unverified"
        }
      ]
    },
    {
      "source_id": "aeharding-voyager",
      "source_name": "aeharding/voyager",
      "source_type": "github",
      "source_url": "https://github.com/aeharding/voyager",
      "classification": "Experimental",
      "verification_status": "unverified",
      "reputation_score": 73.9,
      "health_status": "unknown",
      "uptime": null,
      "first_seen": "2026-09-12T18:15:03Z",
      "last_seen": "2026-09-12T18:51:37Z",
      "last_sync": "2026-09-06",
      "app_count": 1,
      "release_count": 0,
      "apps": [
        {
          "id": "voyager",
          "name": "Voyager",
          "version": "2.49.0"
        }
      ],
      "history": [
        {
          "at": "2026-09-12T18:15:03Z",
          "health": "unknown",
          "reputation": 73.9,
          "appCount": 1,
          "verification": "unverified"
        },
        {
          "at": "2026-09-12T18:51:37Z",
          "health": "unknown",
          "reputation": 73.9,
          "appCount": 1,
          "verification": "unverified"
        }
      ]
    },
    {
      "source_id": "aidoku-aidoku",
      "source_name": "Aidoku/Aidoku",
      "source_type": "github",
      "source_url": "https://github.com/Aidoku/Aidoku",
      "classification": "Experimental",
      "verification_status": "unverified",
      "reputation_score": 73.9,
      "health_status": "unknown",
      "uptime": null,
      "first_seen": "2026-09-12T18:15:03Z",
      "last_seen": "2026-09-12T18:51:37Z",
      "last_sync": "2026-09-03",
      "app_count": 1,
      "release_count": 0,
      "apps": [
        {
          "id": "aidoku",
          "name": "Aidoku",
          "version": "0.9"
        }
      ],
      "history": [
        {
          "at": "2026-09-12T18:15:03Z",
          "health": "unknown",
          "reputation": 73.9,
          "appCount": 1,
          "verification": "unverified"
        },
        {
          "at": "2026-09-12T18:51:37Z",
          "health": "unknown",
          "reputation": 73.9,
          "appCount": 1,
          "verification": "unverified"
        }
      ]
    },
    {
      "source_id": "anxcye-anx-reader",
      "source_name": "Anxcye/anx-reader",
      "source_type": "github",
      "source_url": "https://github.com/Anxcye/anx-reader",
      "classification": "Experimental",
      "verification_status": "unverified",
      "reputation_score": 73.9,
      "health_status": "unknown",
      "uptime": null,
      "first_seen": "2026-09-12T18:15:03Z",
      "last_seen": "2026-09-12T18:51:37Z",
      "last_sync": "2026-03-19",
      "app_count": 1,
      "release_count": 0,
      "apps": [
        {
          "id": "anxreader",
          "name": "Anx Reader",
          "version": "1.14.0"
        }
      ],
      "history": [
        {
          "at": "2026-09-12T18:15:03Z",
          "health": "unknown",
          "reputation": 73.9,
          "appCount": 1,
          "verification": "unverified"
        },
        {
          "at": "2026-09-12T18:51:37Z",
          "health": "unknown",
          "reputation": 73.9,
          "appCount": 1,
          "verification": "unverified"
        }
      ]
    },
    {
      "source_id": "apollo-reborn-apollo-reborn",
      "source_name": "Apollo-Reborn/Apollo-Reborn",
      "source_type": "github",
      "source_url": "https://github.com/Apollo-Reborn/Apollo-Reborn",
      "classification": "Experimental",
      "verification_status": "unverified",
      "reputation_score": 73.9,
      "health_status": "unknown",
      "uptime": null,
      "first_seen": "2026-09-12T18:15:03Z",
      "last_seen": "2026-09-12T18:51:37Z",
      "last_sync": "2026-09-11",
      "app_count": 1,
      "release_count": 0,
      "apps": [
        {
          "id": "apollo",
          "name": "Apollo",
          "version": "3.7.0"
        }
      ],
      "history": [
        {
          "at": "2026-09-12T18:15:03Z",
          "health": "unknown",
          "reputation": 73.9,
          "appCount": 1,
          "verification": "unverified"
        },
        {
          "at": "2026-09-12T18:51:37Z",
          "health": "unknown",
          "reputation": 73.9,
          "appCount": 1,
          "verification": "unverified"
        }
      ]
    },
    {
      "source_id": "ashreq-ashstore-repo",
      "source_name": "Ashreq/ashstore-repo",
      "source_type": "github",
      "source_url": "https://github.com/Ashreq/ashstore-repo",
      "classification": "Experimental",
      "verification_status": "unverified",
      "reputation_score": 73.9,
      "health_status": "unknown",
      "uptime": null,
      "first_seen": "2026-09-12T18:15:03Z",
      "last_seen": "2026-09-12T18:51:37Z",
      "last_sync": "2026-08-03",
      "app_count": 1,
      "release_count": 0,
      "apps": [
        {
          "id": "maxtube",
          "name": "MaxTube",
          "version": "21.31.3"
        }
      ],
      "history": [
        {
          "at": "2026-09-12T18:15:03Z",
          "health": "unknown",
          "reputation": 73.9,
          "appCount": 1,
          "verification": "unverified"
        },
        {
          "at": "2026-09-12T18:51:37Z",
          "health": "unknown",
          "reputation": 73.9,
          "appCount": 1,
          "verification": "unverified"
        }
      ]
    },
    {
      "source_id": "ayman708-ux-playtorriov3",
      "source_name": "ayman708-UX/PlayTorrioV3",
      "source_type": "github",
      "source_url": "https://github.com/ayman708-UX/PlayTorrioV3",
      "classification": "Experimental",
      "verification_status": "unverified",
      "reputation_score": 73.9,
      "health_status": "unknown",
      "uptime": null,
      "first_seen": "2026-09-12T18:15:03Z",
      "last_seen": "2026-09-12T18:51:37Z",
      "last_sync": "2026-09-09",
      "app_count": 1,
      "release_count": 0,
      "apps": [
        {
          "id": "playtorrio",
          "name": "PlayTorrio",
          "version": "1.1.5"
        }
      ],
      "history": [
        {
          "at": "2026-09-12T18:15:03Z",
          "health": "unknown",
          "reputation": 73.9,
          "appCount": 1,
          "verification": "unverified"
        },
        {
          "at": "2026-09-12T18:51:37Z",
          "health": "unknown",
          "reputation": 73.9,
          "appCount": 1,
          "verification": "unverified"
        }
      ]
    },
    {
      "source_id": "bandarhl-bhtwitter",
      "source_name": "BandarHL/BHTwitter",
      "source_type": "github",
      "source_url": "https://github.com/BandarHL/BHTwitter",
      "classification": "Experimental",
      "verification_status": "unverified",
      "reputation_score": 71.4,
      "health_status": "unknown",
      "uptime": null,
      "first_seen": "2026-09-12T18:15:03Z",
      "last_seen": "2026-09-12T18:51:37Z",
      "last_sync": "2025-05-13",
      "app_count": 1,
      "release_count": 0,
      "apps": [
        {
          "id": "bhtwitter",
          "name": "BHTwitter",
          "version": "4.4"
        }
      ],
      "history": [
        {
          "at": "2026-09-12T18:15:03Z",
          "health": "unknown",
          "reputation": 71.4,
          "appCount": 1,
          "verification": "unverified"
        },
        {
          "at": "2026-09-12T18:51:37Z",
          "health": "unknown",